{
    "name": "awesome-date-annotator",
    "version": "1.0.0",
    "license": "Apache-2.0",
    "repository": "github:awesome-org/awesome-date-annotator",
    "description": "An awesome Date Annotator based on regex patterns",
    "author": "The author of the Tool",
    "authorEmail": "author@example.com",
    "url": "https://example.com"
}